order_id,customer_id,date,nearest_warehouse,shopping_cart,order_price,delivery_charges,customer_lat,customer_long,coupon_discount,order_total,season,is_expedited_delivery,distance_to_nearest_warehouse,latest_customer_review,is_happy_customer
ORD210379,ID2789608266,2019-02-28,Bakers,"[('Lucent 330S', 2), ('iAssist Line', 1), ('Thunder line', 1), ('Olivia x460', 1)]",8090,79.98,-37.8031624,144.9829398,25,6147.48,Summer,False,1.3219,"a good has audio issues with the phone, but other than that, a good product",True
ORD462559,ID0581717087,2019-06-10,Thompson,"[('Toshika 750', 1), ('Thunder line', 1), ('Alcon 10', 2)]",24400,67.29,-37.8051953,144.9331841,15,20807.29,Winter,False,1.4779,buy it works and looks like a brand new phone,True
ORD059340,ID0247018750,2019-11-26,Nickolson,"[('Universe Note', 1), ('Alcon 10', 1), ('iStream', 2), ('Thunder line', 1)]",14880,75.16,-37.8114445,144.9689005,15,12723.16,Spring,False,0.798,five stars is very good phone i like it,True
ORD142116,ID0257505386,2019-09-06,Thompson,"[('Alcon 10', 1), ('pearTV', 1), ('Candle Inferno', 2)]",16120,71.88,-37.7992542,144.962665,25,12161.88,Spring,False,2.028,i didn't recieve this item n im very disappointed i ordered two phone of this same brand one ... i didn't recieve this item n im very disappointed i ordered two phone of this same brand one copper n one black i only recieve the copper,False
ORD012327,ID2133733623,2019-01-20,Thompson,"[('Toshika 750', 2), ('Candle Inferno', 1), ('iAssist Line', 1), ('iStream', 2)]",11595,67.11,-37.81344710000001,144.9501208,15,9922.86,Summer,False,0.2819,five stars very nice phone ancase,True
ORD426283,ID4698523258,2019-01-22,Bakers,"[('iAssist Line', 2), ('pearTV', 1)]",10760,94.4,-37.8007346,145.0020597,5,10316.4,Summer,True,1.1931,"super duración de batería maravilloso, estoy muy contento. funciona perfecto en argentina, la batería es muy duradera (2 días completos con le uso que le doy, o sea bastante) lindo diseño pantalla y características. no es pesado.",True
ORD194004,ID1224821973,2019-06-22,Thompson,"[('Lucent 330S', 2), ('Thunder line', 2), ('pearTV', 1), ('iStream', 2)]",13430,77.68,-37.81361370000001,144.9377835,10,12164.68,Winter,True,0.8233,i got 2 of these for my 8 yr old twins. my 11 yr old has one but this one is better. perfect way to get them to read,True
ORD226223,ID4283908164,2019-03-24,Bakers,"[('Toshika 750', 1), ('iStream', 2), ('Universe Note', 1)]",8070,79.23,-37.8105845,145.0006459,5,7745.73,Autumn,True,0.4806,"great phone great phone, easy to use, helpful features, serves my needs. i am very satisfied. i got this phone after having an alcon and i'm very happy with it! worthwhile buy!",True
ORD043232,ID4733727870,2019-07-18,Thompson,"[('iAssist Line', 1), ('Alcon 10', 1)]",11175,61.47,-37.8043534,144.94923380000003,25,8442.72,Winter,True,0.9455,not from this buyer ever again it was a piece of crap. did not work right at all,False
ORD080155,ID0650269351,2019-04-28,Nickolson,"[('Olivia x460', 2), ('Alcon 10', 2), ('Universe Note', 1), ('pearTV', 2)]",36420,50.36,-37.8146852,144.98019219999995,0,36470.36,Autumn,False,1.032,xp lumia 900 this phone is defective it doesn't work any comes messed up i can't believe i paid for this crap.it broke down on me the first day i got it and i had to send it to a repair shop..this phone is literally no good please be aware of it.and the sender is crap i got it from a bull crap sender,False
ORD496418,ID0128982276,2019-04-25,Nickolson,"[('Universe Note', 2), ('Olivia x460', 2)]",9350,65.47,-37.81780379999999,144.9624239,25,7077.97,Autumn,False,0.6329,great! i love it great ! i love it !,True
ORD491365,ID0145235381,2019-09-07,Nickolson,"[('Olivia x460', 1), ('iStream', 2), ('iAssist Line', 1)]",3750,88.95,-37.8164539,144.9592888,0,3838.95,Spring,True,0.9334,not worth it battery problems from the beginning. was a gift for someone so return was impossible. metro pcs store was not helpful,False
ORD310014,ID0370751788,2019-02-13,Bakers,"[('iAssist Line', 1), ('Alcon 10', 1), ('Toshika 750', 1), ('Universe Note', 2)]",22395,58.17,-37.8155547,144.9880593,15,19093.92,Summer,False,0.8836,wrong phone was not the same as from the photos,False
ORD148888,ID0250933571,2019-08-10,Bakers,"[('iStream', 2), ('Alcon 10', 2), ('Candle Inferno', 1), ('Thunder line', 1)]",20810,80.32,-37.8227967,145.00501630000005,25,15687.82,Winter,True,1.6645,great phone my hubby is dangerous on cell phones. he drops then ask the time in water in dirt pretty probably even in the toilet....lol this phone is durable and small enough fir his pocket he loves it.,True
ORD054533,ID1994687832,2019-07-13,Thompson,"[('Toshika 750', 2), ('iAssist Line', 2), ('Lucent 330S', 2)]",15550,79.23,-37.79942970000001,144.9508937,10,14074.23,Winter,True,1.5121,olivia universe s4 upgraded from a universe s1 to the s4 and i am very impressed with the new phone. very powerful and easy to use. a must.,True
ORD208796,ID6167359501,2019-06-22,Nickolson,"[('Candle Inferno', 1), ('pearTV', 1), ('Alcon 10', 1), ('Toshika 750', 2)]",24330,52.91,-37.8093731,144.97284580000004,25,18300.41,Winter,False,1.0667,one star this thing should be called the s6.5.,False
ORD078743,ID6167247290,2019-10-17,Nickolson,"[('Candle Inferno', 1), ('iStream', 2), ('Olivia x460', 2), ('iAssist Line', 2)]",7630,102.51,-37.819178,144.9610553,15,6588.01,Spring,True,0.7499,"metro pcs compatible, great phone awesome phone, lots of great features. selfie camera is amazing, really clear, dual flash. the screen size is great for watching videos. compatible with metro pcs.",True
ORD392716,ID2288769426,2019-04-21,Bakers,"[('Alcon 10', 2), ('Universe Note', 1), ('pearTV', 2)]",33970,81.29,-37.801807399999994,145.0041975,5,32352.79,Autumn,True,1.2053,"five stars good quality item, recommended",True
ORD365636,ID6206936510,2019-12-23,Thompson,"[('Alcon 10', 2), ('iAssist Line', 1), ('Candle Inferno', 1), ('Toshika 750', 1)]",24875,92.9,-37.80589620000001,144.9443458,0,24967.9,Summer,True,0.7915,five stars so far so good!,True
ORD174590,ID0145210375,2019-08-22,Thompson,"[('pearTV', 2), ('iStream', 1)]",12770,79.23,-37.81698,144.9574679,0,12849.23,Winter,True,1.0325,excelent condition! the phone was in perfect conditions!,True
ORD025763,ID0777793465,2019-09-04,Thompson,"[('Lucent 330S', 2), ('pearTV', 1), ('iStream', 2), ('Universe Note', 2)]",15970,79.16,-37.8070658,144.95555819999996,10,14452.16,Spring,False,0.9732,five stars amazing look and crystal clear voice in the affordable price,True
ORD313039,ID0122860230,2019-03-28,Nickolson,"[('Lucent 330S', 1), ('pearTV', 2)]",13850,51.14,-37.81936320000001,144.9571746,10,12516.14,Autumn,False,1.0917,i had a hard time trying to stream movies even with a good internet connection ....was a little disappointed,False
ORD339999,ID0767658365,2019-08-12,Nickolson,"[('Candle Inferno', 1), ('Olivia x460', 1), ('Toshika 750', 2), ('Alcon 10', 2)]",28195,65.61,-37.8073143,144.97332240000003,10,25441.11,Winter,False,1.2988,the tablet works just great and the price can't be beat!,True
ORD320810,ID0091971021,2019-07-14,Thompson,"[('pearTV', 1), ('Alcon 10', 1), ('Lucent 330S', 2), ('Candle Inferno', 1)]",18150,74.04,-37.8178305,144.9487158,0,18224.04,Winter,True,0.5921,"one of the best purchased even factory refurb great phone, less expensive than getting a replacement phone thru carriers insurance plan.",True
ORD335999,ID4733727848,2019-02-25,Thompson,"[('Toshika 750', 2), ('Olivia x460', 2)]",11090,75.57,-37.8041756,144.94908230000001,0,11165.57,Summer,False,0.9624,works as advertised. very easy to setup. still learning what this can do.,True
ORD472604,ID2187770703,2019-02-13,Nickolson,"[('pearTV', 2), ('Alcon 10', 2), ('iStream', 1)]",30670,90.7,-37.8125165,144.9651979,10,27693.7,Summer,True,0.7774,excellent device great battery life stunning pictures no lags and upgradeable to android 9 only dislike the bottom speakers overal amazing mid-tier phone,True
ORD184749,ID0667680182,2019-05-07,Nickolson,"[('Alcon 10', 2), ('Olivia x460', 1)]",19125,65.55,-37.81322,144.97127880000005,5,18234.3,Autumn,False,0.6173,must buy product! excellent product. must buy. thank you google,True
ORD077029,ID3143370319,2019-10-14,Thompson,"[('Olivia x460', 2), ('Candle Inferno', 1)]",2880,72.53,-37.8142222,144.94291069999997,25,2232.53,Spring,False,0.4043,great battery life! i absolutely love this phone! great camera excellent fingerprint sensor. excellent battery life. i can go all day watching videos. i've always loved olivia but this is the best i've had so far.,True
ORD343058,ID6167278765,2019-09-11,Thompson,"[('Olivia x460', 1), ('Universe Note', 1), ('iStream', 2)]",4975,97.58,-37.8133248,144.9513498,5,4823.83,Spring,True,0.3834,excellent phone my husband loves this phone i'm thinking of getting one for myself i have the universe 2 n love it but i'm really falling in love with the focus,True
ORD021942,ID4148846636,2019-05-27,Nickolson,"[('Olivia x460', 1), ('Universe Note', 2)]",8125,81.57,-37.8225268,144.9834835,0,8206.57,Autumn,True,1.301,performance is great no problems purchased this for my mother it’s easy to use and has a large screen display it’s been a very good phone,True
ORD376357,ID2189497217,2019-03-04,Nickolson,"[('Lucent 330S', 1), ('Olivia x460', 1), ('Alcon 10', 1)]",11405,65.45,-37.8110323,144.97285630000005,10,10329.95,Autumn,False,0.8906,love this phone! my bf bought this for me because my old s7 was constantly dying on me. the pen feature is awesome. it did come unlock and setup for t-mobile (which is my phone company) so all i had to do was change out my sim card. it works really well and as expected. thank you!,True
ORD412662,ID0395252764,2019-07-29,Bakers,"[('Candle Inferno', 1), ('pearTV', 2)]",13050,55.29,-37.7994265,144.97719709999996,5,12452.79,Winter,False,1.9749,sad shattered within two weeks,False
ORD121526,ID0267317332,2019-11-03,Nickolson,"[('iAssist Line', 2), ('Candle Inferno', 1)]",4880,99.43,-37.823541,144.97130330000005,25,3759.43,Spring,True,0.5717,five stars extremely satisfied. best phone u ever had shipped without a problem and received promptly,True
ORD036124,ID4520380506,2019-11-26,Thompson,"[('Universe Note', 1), ('iStream', 1), ('Candle Inferno', 1)]",4030,101.25,-37.8117157,144.9565014,15,3526.75,Spring,True,0.8363,love it obsessed with the battery life,True
ORD045105,ID3327893029,2019-05-31,Thompson,"[('Thunder line', 2), ('iAssist Line', 1), ('Candle Inferno', 2), ('Universe Note', 2)]",14345,66.16,-37.8065465,144.9595075,5,13693.91,Autumn,False,1.2891,awesome phone awesome phone. flagship features for budget phone price.,True
ORD030934,ID0560989015,2019-05-17,Thompson,"[('iAssist Line', 1), ('Alcon 10', 2), ('Candle Inferno', 2), ('iStream', 1)]",21135,78.21,-37.820303100000004,144.94651230000005,25,15929.46,Autumn,True,0.8507,love my new pixel phone the phone looked very clean when i received it. i upgraded from nexus 6 to this phone and am very happy with it. it takes good pictures quickly and battery lasts very long.,True
ORD079948,ID6167413273,2019-04-09,Nickolson,"[('Universe Note', 2), ('Thunder line', 1), ('Candle Inferno', 2), ('iStream', 2)]",10240,79.82,-37.815107899999994,144.9605892,25,7759.82,Autumn,True,0.8785,"great phone,does everything expensive phones do wife loves it",True
ORD281773,ID3210158654,2019-03-14,Thompson,"[('iStream', 1), ('Universe Note', 1)]",3600,63.17,-37.8085942,144.948182,15,3123.17,Autumn,True,0.4645,not unlocked this is a at&t phone not unlocked,False
ORD428990,ID6167344494,2019-04-15,Nickolson,"[('iAssist Line', 2), ('Thunder line', 2), ('Lucent 330S', 2), ('Olivia x460', 1)]",12495,82.28,-37.8087625,144.9664167,15,10703.03,Autumn,True,1.1287,"i looooooove this phone!!! i love this phone!! it's awesome!! definitely will buy again! if i break this one 😂.. sorry, i'm accident prone 🤣😂🤣",True
ORD240266,ID0746924331,2019-07-13,Nickolson,"[('Thunder line', 2), ('Toshika 750', 1)]",8680,53.0,-37.8250884,144.9825927,10,7865.0,Winter,False,1.3556,"not worth for the price. 4g sim on this phone is not working. the same sim is working on lg g3, but not on this. very disappointing...even the screen is also made out of cheap quality and not a scratch free screen.",False
ORD410340,ID1479905361,2019-09-01,Nickolson,"[('Lucent 330S', 2), ('iAssist Line', 1), ('Candle Inferno', 1)]",5115,105.55,-37.8208049,144.95619530000005,25,3941.8,Spring,True,1.1999,perfect for the trade up deals bought it to use as a trade in on the 11 for my husband.,True
ORD167927,ID0846546861,2019-12-29,Nickolson,"[('Alcon 10', 2), ('iStream', 2), ('iAssist Line', 1)]",20425,87.53,-37.82011110000001,144.9684911,15,17448.78,Summer,True,0.1928,good good condition,True
ORD191479,ID0844490911,2019-10-08,Thompson,"[('Alcon 10', 2), ('Lucent 330S', 1), ('Thunder line', 2), ('Candle Inferno', 2)]",24350,102.32,-37.820342499999995,144.94957319999997,5,23234.82,Spring,True,0.8817,works great,True
ORD275323,ID0579992983,2019-12-04,Thompson,"[('Olivia x460', 1), ('iAssist Line', 1), ('pearTV', 1), ('Universe Note', 2)]",16660,74.2,-37.807383200000004,144.94148769999995,15,14235.2,Summer,False,0.7666,works perfectly i was first scared to buy this product after reading all the reviews but after receiving it looking brand new i was not disappointed. it connected easily to att and now works great!!,True
ORD093979,ID0332544912,2019-10-07,Thompson,"[('Thunder line', 1), ('Candle Inferno', 2)]",3040,57.18,-37.8102047,144.949947,5,2945.18,Spring,False,0.3736,olivia not in my life my company uses these phones at my work. the darn thing keeps turning itself off or restarting by itself. for a work phone it's a piece of crap. and i definitely would not have one for myself personally.,False
ORD117985,ID0581702905,2019-10-16,Thompson,"[('pearTV', 2), ('Olivia x460', 1), ('Candle Inferno', 1)]",14275,111.71,-37.81575,144.92155590000004,5,13672.96,Spring,True,2.2696,always make me happy i buy over 6 phones from mr device never ... always make me happy i buy over 6 phones from mr device never have any issue just got two universe s7 edge my friend love them. fast shipping and good costumer support,True
ORD307601,ID0702363471,2019-04-04,Thompson,"[('Alcon 10', 2), ('Lucent 330S', 2), ('Olivia x460', 1)]",21585,77.65,-37.8063174,144.9415754,15,18424.9,Autumn,True,0.8567,"which is great! it worked as expected, which is great!",True
ORD386793,ID4754200377,2019-07-01,Thompson,"[('Toshika 750', 1), ('Olivia x460', 1), ('Alcon 10', 2), ('iAssist Line', 1)]",25670,54.42,-37.81521160000001,144.9275535,25,19306.92,Winter,False,1.7393,"never by an expensive item that doesn't come with a warranty. this phone was very good until it would no longer connect to my carrier. since there was no warranty, i now have a very expensive paper weight.",False
ORD002045,ID6167191722,2019-11-16,Nickolson,"[('Alcon 10', 1), ('Thunder line', 2)]",13310,102.59,-37.81772539999999,144.9592006,5,12747.09,Spring,True,0.9153,suggested by the sales associate i'm glad i took his suggestion,True
ORD095432,ID2613010008,2019-03-22,Thompson,"[('Universe Note', 2), ('Lucent 330S', 1)]",8130,68.86,-37.8093814,144.9317534,15,6979.36,Autumn,False,1.3959,"i love using my thunder show for music, it sounds amazing! unfortunately the video quality when video chatting isnt great, my husband and i video chat often and his video comes out very clear on my end but he says my image is very pixelated. i'm still learning to use it but so far so good.",True
ORD353830,ID5402876530,2019-03-25,Nickolson,"[('Alcon 10', 2), ('Toshika 750', 1), ('Olivia x460', 1), ('Candle Inferno', 2)]",24305,48.37,-37.8210245,144.9767611,10,21922.87,Autumn,False,0.6893,"this is the worst phone i've ever had it constantly freezes this is the worst phone i've ever had it constantly freezes, the battery is always dead, and it doesn't like to turn on when it's turned off",False
ORD243266,ID0207093529,2019-12-04,Bakers,"[('iStream', 1), ('iAssist Line', 2)]",4600,79.18,-37.8010486,145.0043017,0,4679.18,Summer,False,1.2761,bought this for my 8 year old in place of a nabi that didn't work out of the package. great basic tablet for this.,True
ORD091758,ID0579383947,2019-03-21,Bakers,"[('Toshika 750', 2), ('Universe Note', 2)]",15540,67.03,-37.798441,144.99458909999996,5,14830.03,Autumn,False,1.2875,good quality of picture like pear recommend this phone for every body,True
ORD037843,ID0493873181,2019-04-10,Nickolson,"[('Lucent 330S', 2), ('Thunder line', 1), ('Alcon 10', 1), ('pearTV', 2)]",26210,83.18,-37.8054323,144.9696279,25,19740.68,Autumn,True,1.4652,"great service experience to summarize it all, i would buy again & encourage anyone to buy too.",True
ORD497454,ID0777786795,2019-02-28,Thompson,"[('iStream', 1), ('Lucent 330S', 2), ('pearTV', 1), ('Universe Note', 1)]",12370,93.74,-37.8055875,144.9536203,5,11845.24,Summer,True,0.9768,five stars ok,True
ORD187129,ID0302820279,2019-10-21,Bakers,"[('iStream', 2), ('iAssist Line', 1), ('Candle Inferno', 1), ('Toshika 750', 2)]",11595,73.18,-37.8146704,144.9952074,5,11088.43,Spring,False,0.5203,good to buy olivia universe phones are very strong i bought it for my son he likes it so much,True
ORD325907,ID0031477169,2019-04-13,Bakers,"[('Olivia x460', 1), ('Universe Note', 1), ('Lucent 330S', 2), ('iAssist Line', 2)]",11585,68.73,-37.7989598,144.9842738,0,11653.73,Autumn,False,1.5615,"excellent cellphone looks like new. excellent cellphone, battery last all day with a single charge. so far i am very happy, not any problems.",True
ORD106348,ID3810637333,2019-03-28,Thompson,"[('iStream', 2), ('Universe Note', 1), ('iAssist Line', 2)]",8200,65.97,-37.8206841,144.94136719999997,15,7035.97,Autumn,False,1.023,good camera. but there's a problem in the back ... good camera.but there's a problem in the back of the phone.it's ok,True
ORD230723,ID3213448189,2019-12-13,Thompson,"[('iAssist Line', 2), ('Thunder line', 1)]",6630,61.71,-37.805643599999996,144.9571435,10,6028.71,Summer,False,1.1821,didn't receive full order don't order from we deliver wireless. we ordered 2 phones and only received 1 and it's been a hassle to get ahold of them for a refund on the one phone. however the phone does work and is what we ordered. so just beaware if you're trying to order multiple.,False
ORD370771,ID4518401168,2019-06-18,Thompson,"[('Universe Note', 2), ('iStream', 2), ('Candle Inferno', 2), ('Toshika 750', 2)]",16700,76.08,-37.8073281,144.94941169999996,5,15941.08,Winter,True,0.6297,love it i am very pleased with my purchase. i was worried about buying a used phone but that was put to rest when it got here. it was in wonderful condition! i am one happy customer!,True
ORD320958,ID2088335572,2019-10-03,Nickolson,"[('iAssist Line', 2), ('Universe Note', 1), ('Toshika 750', 2)]",16540,77.75,-37.823145000000004,144.9781905,10,14963.75,Spring,False,0.9131,no contract and affordable i like that the phone was affordable and didn't include a 2 year contract. the phone works good. no issues to report.,True
ORD199300,ID2183290172,2019-12-26,Nickolson,"[('Lucent 330S', 2), ('Universe Note', 2), ('Toshika 750', 1)]",13680,99.17,-37.8073965,144.96284319999995,0,13779.17,Summer,True,1.3791,xp phone i received my phone on time and the phone was exactly what i wanted. it has preformed perfectly. i am very happy with my overall experience.,True
ORD224409,ID4973179165,2019-05-15,Thompson,"[('Toshika 750', 2), ('iStream', 1), ('Lucent 330S', 2)]",11250,66.61,-37.8051249,144.9614898,10,10191.61,Autumn,False,1.5214,"excellent phone best camera i've ever had on a phone. i also really like the active edge feature. the condition of the phone was very good, as advertised. i would definitely buy it again.",True
ORD438363,ID4716795169,2019-08-01,Thompson,"[('Thunder line', 1), ('iAssist Line', 1)]",4405,65.12,-37.8187917,144.9535351,10,4029.62,Winter,False,0.8873,"long battery life, good screen, reasonably fast.gaming.",True
ORD258324,ID2473002365,2019-11-21,Bakers,"[('Candle Inferno', 1), ('Alcon 10', 1), ('iAssist Line', 2)]",13830,76.93,-37.8042115,145.002375,10,12523.93,Spring,False,0.8996,"five stars beautiful, i love it!",True
ORD195929,ID1224821973,2019-10-23,Thompson,"[('Lucent 330S', 2), ('Alcon 10', 1)]",11410,86.72,-37.81361370000001,144.9377835,0,11496.72,Spring,True,0.8233,pear exceeds in all areas minus 4k. tough decision but if i had to choose again i would opt for the new pear tv.,False
ORD415344,ID0443288645,2019-08-14,Bakers,"[('Toshika 750', 2), ('Alcon 10', 1)]",17590,70.48,-37.821279600000004,145.00417190000005,15,15021.98,Winter,False,1.4818,"excellent phone this was purchased as a gift, the recipient absolutely loved it.",True
ORD083008,ID4313862238,2019-06-11,Bakers,"[('Candle Inferno', 2), ('iAssist Line', 2)]",5310,76.9,-37.8182775,144.9933897,0,5386.9,Winter,True,0.936,fast delivery and quality material i like it very much,True
ORD398105,ID0711331520,2019-02-18,Thompson,"[('Toshika 750', 1), ('iStream', 2), ('Olivia x460', 2)]",7070,76.28,-37.8073981,144.95740690000005,15,6085.78,Summer,False,1.0823,glad teen daughter went from an pear to this and loves it. another convery to android.,True
ORD459060,ID4716795448,2019-12-11,Thompson,"[('pearTV', 1), ('Thunder line', 2)]",10670,80.31,-37.8188376,144.9533842,25,8082.81,Summer,True,0.8828,"se raya con nada mala calidad no puedo creer que este celular se raye la pantalla con nada, estoy desepcionado de la calidad, material de la pantalla esta rallada por andar el el bolsillo no puedo creer que huawei venda esta gama con pantallas que se rayan con nada",False
ORD146699,ID1152560937,2019-12-23,Thompson,"[('Universe Note', 1), ('Thunder line', 2), ('Lucent 330S', 2), ('Toshika 750', 1)]",14590,67.94,-37.7983586,144.9523019,15,12469.44,Summer,False,1.6586,worked for one day and then it died i would not buy a renewed or refurbished phone. i am sending this back with the 90 day guarantee.,False
ORD443275,ID2810324703,2019-11-13,Nickolson,"[('iStream', 2), ('Olivia x460', 1), ('Lucent 330S', 1), ('pearTV', 2)]",15375,104.66,-37.8068807,144.974953,5,14710.91,Spring,True,1.3878,five stars awesome.,True
ORD129058,ID6167265868,2019-03-27,Nickolson,"[('iStream', 2), ('Olivia x460', 2), ('Universe Note', 1), ('Candle Inferno', 2)]",7060,64.41,-37.8154836,144.96668069999996,15,6065.41,Autumn,False,0.4286,"slightly buggy a great smartphone, but a buggy messaging app due to an error of downloading or receiving mms occur after a security software update. it looks like huaweii has abandoned the android pie update for the us variant. i had to return it for a full refund.",True
ORD482393,ID0571460260,2019-02-15,Thompson,"[('Candle Inferno', 1), ('pearTV', 2), ('Toshika 750', 2), ('Lucent 330S', 1)]",22920,92.83,-37.810574700000004,144.939228,0,23012.83,Summer,True,0.7281,i just this for listening to talk radio in the morning and turning lights on and off etc. the system does an excellent job as a full house sound system streaming sirius.,True
ORD291575,ID0259616712,2019-10-15,Thompson,"[('pearTV', 1), ('iStream', 2), ('Toshika 750', 2)]",15250,100.47,-37.8141486,144.9547542,15,13062.97,Spring,True,0.6955,"i am an avid digico user for shopping and tablets, i bought a different model for my younger brother and now purchased this one for my grandparents and they love it!",True
ORD471975,ID4520380504,2019-02-07,Thompson,"[('iStream', 2), ('Alcon 10', 1), ('iAssist Line', 1), ('Thunder line', 2)]",15835,73.8,-37.8117766,144.9564575,0,15908.8,Summer,False,0.8317,great phone loved this phone.,True
ORD300519,ID0579487458,2019-07-02,Thompson,"[('iAssist Line', 2), ('Alcon 10', 2), ('Lucent 330S', 2), ('pearTV', 2)]",37430,47.93,-37.8163473,144.9509305,5,35606.43,Winter,False,0.5316,"don't buy 2 months after buying this and the speaker doesn't work. phone is in perfect condition, no damage. but speaker just randomly stopped working.",False
ORD228762,ID0052450490,2019-06-14,Thompson,"[('Olivia x460', 2), ('Toshika 750', 2), ('Thunder line', 2)]",15450,72.96,-37.792201399999996,144.93664209999997,5,14750.46,Winter,True,2.4565,"locked and scratched product arrived with a sticky substance all over it, has scratches on it, and is locked to at&t. not what i expected.",False
ORD080537,ID1224821939,2019-10-14,Thompson,"[('Alcon 10', 2), ('pearTV', 2), ('Thunder line', 1)]",32700,85.84,-37.8122826,144.9384914,5,31150.84,Spring,True,0.7556,one star the product failed not recommend this seller,False
ORD137597,ID2632208067,2019-03-03,Bakers,"[('Olivia x460', 1), ('Candle Inferno', 1), ('iStream', 1), ('Lucent 330S', 1)]",3035,81.01,-37.8178994,144.989793,10,2812.51,Autumn,True,1.0014,phone shows 3g instead of 4g the phone is very nice but my issue is that it says it has 4g capabilities but when i call out it shows 3g,True
ORD330003,ID3144992696,2019-05-13,Bakers,"[('Candle Inferno', 2), ('Olivia x460', 1)]",2085,79.55,-37.8152283,144.9879511,15,1851.8,Autumn,True,0.8656,this is second purchesed: lucent z3 play is a great affordable replacement for lucent z play lucent z3 play is a great affordable replacement for lucent z play.,True
ORD155810,ID6167441059,2019-07-15,Nickolson,"[('Candle Inferno', 2), ('Thunder line', 1), ('iAssist Line', 2)]",7490,66.62,-37.813342,144.9626728,0,7556.62,Winter,False,0.8413,five stars thank you so much,True
ORD321167,ID0202759180,2019-12-15,Thompson,"[('iStream', 1), ('Toshika 750', 2), ('Candle Inferno', 2)]",9650,76.88,-37.8073529,144.9364781,5,9244.38,Summer,False,1.1038,great! great phone. excellent refurb! like brand new condition.,True
ORD390154,ID2992195785,2019-10-04,Nickolson,"[('Toshika 750', 2), ('Olivia x460', 2), ('pearTV', 2)]",23710,74.65,-37.8231535,144.97027759999997,5,22599.15,Spring,False,0.5114,i like the size of the device as well as the expandable storage,True
