order_id,customer_id,date,nearest_warehouse,shopping_cart,order_price,delivery_charges,customer_lat,customer_long,coupon_discount,order_total,season,is_expedited_delivery,distance_to_nearest_warehouse,latest_customer_review,is_happy_customer
ORD142894,ID0847528077,2019-05-28,Nickolson,"[('iAssist Line', 1), ('Olivia x460', 2), ('Candle Inferno', 2), ('Thunder line', 1)]",7715,64.19,-37.823616200000004,144.9672392,0,7779.19,Autumn,False,0.5948,"great for my office. i use this daily in many ways, to include spelling for me and background music.",True
ORD355952,ID0571458041,2019-12-14,Thompson,"[('Universe Note', 1), ('pearTV', 1)]",9760,86.65,-37.815039899999995,144.9459788,0,9846.65,Summer,True,0.2804,"beautiful, though the camara doesn't really take great pictures ... it's everything i hoped for in a cellphone. it is fast, beautiful,though the camara doesn't really take great pictures in low light or dark spaces. eveything else is just perfect!",True
ORD252459,ID0371967864,2019-09-08,Nickolson,"[('Toshika 750', 2), ('iStream', 1), ('iAssist Line', 2)]",13240,65.87,-37.807026799999996,144.9709796,0,13305.87,Spring,False,1.2939,mal estado de la batería. mala inversión la batería está deteriorada. el móvil se descarga en 30 minutos cuando se está usando. muy mala inversión,False
ORD333763,ID6167489450,2019-02-10,Nickolson,"[('Toshika 750', 2), ('Lucent 330S', 1)]",9870,75.91,-37.8139135,144.960299,5,9452.41,Summer,False,0.9662,computer in your hand this is an early review and i reserve the right to change it and probably will i've only had the phone for a couple days now but i'm absolutely amazed by everything so far and think it was worth every penny,True
ORD050273,ID0304186957,2019-12-03,Nickolson,"[('pearTV', 2), ('Alcon 10', 2)]",30520,99.58,-37.826017900000004,144.9827282,5,29093.58,Summer,True,1.4231,so far it does what i want. very happy with the price too.,True
ORD499040,ID0681285208,2019-04-17,Bakers,"[('iAssist Line', 2), ('pearTV', 2)]",17070,63.91,-37.807674299999995,144.9919535,0,17133.91,Autumn,False,0.3872,"five stars best phone ever, works in trinidad just toss in both ur micro sims.",True
ORD186862,ID5856680721,2019-07-15,Nickolson,"[('Thunder line', 1), ('iStream', 2), ('Alcon 10', 1), ('pearTV', 2)]",24050,44.47,-37.81803920000001,144.9669178,5,22891.97,Winter,False,0.2397,shutting down had this phone for 1 month and it just shuts down every 2-3mins and then i have to hard reset it. then it shuts down again.,False
ORD037582,ID4305737095,2019-07-26,Bakers,"[('pearTV', 2), ('Lucent 330S', 2), ('iStream', 2), ('Candle Inferno', 2)]",16240,68.91,-37.81274310000001,145.0125292,15,13872.91,Winter,False,1.5516,cool phone thanks for the nice phone !,True
ORD075342,ID3148693048,2019-10-29,Nickolson,"[('pearTV', 2), ('iAssist Line', 1)]",14845,79.41,-37.8088582,144.97510590000005,15,12697.66,Spring,False,1.1889,the phone runs good. the phone looks good.,True
ORD369807,ID2383211220,2019-12-28,Nickolson,"[('Toshika 750', 2), ('Universe Note', 2), ('iAssist Line', 2)]",19990,56.35,-37.813499900000004,144.9655868,0,20046.35,Summer,False,0.6657,don't waste your money it is junk. don't buy it as the screen is a real problem. we sent it to china with the warranty. they repaired it. after 1 month same problem again.:-/,False
ORD462726,ID3164000435,2019-03-09,Thompson,"[('Toshika 750', 2), ('Thunder line', 2), ('Lucent 330S', 2), ('Candle Inferno', 2)]",16320,55.96,-37.8003161,144.9263344,15,13927.96,Autumn,False,2.2842,broken in 2month. no us warranty no warranty in the us. i bought this two months ago and mainboard is broken. i cannot turn it on now.,False
ORD016684,ID0709970051,2019-09-24,Thompson,"[('iAssist Line', 1), ('Candle Inferno', 2)]",3085,79.33,-37.8142705,144.935746,25,2393.08,Spring,False,1.0115,"battery is a joke sold as new, battery is near it's age limit.",True
ORD305671,ID5776644660,2019-09-25,Bakers,"[('Universe Note', 1), ('iStream', 2), ('Candle Inferno', 2)]",4610,77.22,-37.8007475,145.0034602,25,3534.72,Spring,False,1.2584,great phone great phone. i love the note series olivia phones!,True
ORD089703,ID0591398356,2019-02-18,Nickolson,"[('Thunder line', 2), ('Alcon 10', 2), ('pearTV', 2)]",34880,76.68,-37.821418,144.9614566,25,26236.68,Summer,True,0.7781,fraud alert the phone i recieved was on verizon's fraud list. do not buy.,False
ORD265977,ID0529205283,2019-12-15,Thompson,"[('Universe Note', 2), ('Alcon 10', 2)]",24800,79.53,-37.823281200000004,144.938265,0,24879.53,Summer,False,1.412,highly recommend it works great! haven't encounter any bugs or problems with software. had mines for almost a month with no hiccup or decrease in performance.,True
ORD077374,ID0247032409,2019-12-04,Nickolson,"[('Universe Note', 2), ('Lucent 330S', 2)]",9360,78.57,-37.8140799,144.9737248,0,9438.57,Summer,True,0.6224,i only but it for the price. i won't be trading it for my i pad,False
ORD031221,ID0575379884,2019-04-26,Nickolson,"[('Thunder line', 2), ('Lucent 330S', 1), ('pearTV', 2)]",18210,52.06,-37.81977979999999,144.98252,5,17351.56,Autumn,False,1.148,manden lo que es en la foto de la descripción no es el teléfono que dicen en la descripción me mandaron otro telefono,False
ORD167352,ID2288769462,2019-08-13,Bakers,"[('Lucent 330S', 2), ('iAssist Line', 1)]",4685,66.23,-37.801905,145.00343569999995,0,4751.23,Winter,False,1.154,smooth transaction! just as described!! thanks!,True
ORD286719,ID0259132670,2019-09-29,Nickolson,"[('iAssist Line', 2), ('Alcon 10', 2), ('pearTV', 1)]",28660,103.6,-37.8256512,144.9600263,15,24464.6,Spring,True,1.1482,"best phone i have used wife has an alcon 7, son has an alcon 6s+. this phone is great. battery life is astounding. i have not turned on the facial recognition, but finger print reader works great. i see why this won several ""best phone under $250"" awards.",True
ORD237217,ID2473002365,2019-06-28,Bakers,"[('Universe Note', 2), ('Thunder line', 1), ('Alcon 10', 1)]",18030,65.74,-37.8042115,145.002375,15,15391.24,Winter,False,0.8996,great phone the phone looks great...for my usage there is no lag.... screen looks great and i get 2 days of battery life ...,True
ORD360183,ID0114577436,2019-06-13,Nickolson,"[('Candle Inferno', 2), ('Universe Note', 1)]",4310,45.6,-37.8170959,144.96634740000005,25,3278.1,Winter,False,0.3274,"it not good working and sound system is not working properly it not good working and sound system is not working properly,so i not prefer next time digico and money waste",False
ORD475345,ID5446793543,2019-04-02,Nickolson,"[('pearTV', 1), ('Olivia x460', 2)]",8760,71.33,-37.832819,144.9905243,0,8831.33,Autumn,False,2.4306,easy to use good products,True
ORD411689,ID4330491092,2019-10-12,Thompson,"[('Candle Inferno', 1), ('Lucent 330S', 1)]",1660,86.27,-37.8205151,144.9272465,25,1331.27,Spring,False,1.9495,amazing phone excelent product. i am always buying from digico. 100% recommended,True
ORD397363,ID6282174159,2019-09-11,Nickolson,"[('Candle Inferno', 1), ('Thunder line', 1)]",2610,101.46,-37.8230804,144.97799519999995,15,2319.96,Spring,True,0.8948,he us happy and so am i just like my dad's old phone. he's happy and so am i.,True
ORD195705,ID4735688181,2019-02-21,Thompson,"[('iAssist Line', 2), ('Thunder line', 2)]",8810,96.31,-37.80324279999999,144.9491271,25,6703.81,Summer,True,1.0653,this is a great gift for my 6 year old nephew. he will enjoy it for hours.,True
ORD486797,ID0030947751,2019-09-10,Bakers,"[('iAssist Line', 2), ('Toshika 750', 1), ('Alcon 10', 1), ('Thunder line', 1)]",19900,89.12,-37.8207972,144.9942398,0,19989.12,Spring,True,1.2055,"i never write reviews but damn this phone sucks. it is very laggy i never write reviews but damn this phone sucks. it is very laggy. i dont have any apps opened yet the 2g of memory is in constant struggle. i switched to alcon, again. it just doesnt work guys. get another android phone. you will regret it.",False
ORD057602,ID0501027454,2019-01-26,Nickolson,"[('Alcon 10', 1), ('pearTV', 2), ('Lucent 330S', 1), ('iAssist Line', 2)]",27250,85.71,-37.8009998,144.97232350000004,5,25973.21,Summer,False,1.9738,"good price, bought it already owned a lucent g something happened to it. went on line saw this one, good price, bought it, ok to go agaoin",True
ORD170608,ID5058108329,2019-10-18,Nickolson,"[('iAssist Line', 2), ('pearTV', 1), ('Alcon 10', 1)]",19710,74.42,-37.82324420000001,144.96802119999995,5,18798.92,Spring,False,0.5347,"great phone love it, works well for me",True
ORD183279,ID2384091392,2019-03-19,Nickolson,"[('Lucent 330S', 1), ('Olivia x460', 1)]",2455,63.62,-37.8177426,144.9660599,25,1904.87,Autumn,False,0.3213,"lucent again! for the few days of use this phone has done nothing but delivered. fingerprint reader is responsive and easy to access, i'm getting almost 2 days of battery life with moderate use (results will vary when gaming). no lag so far. this was a good purchase.",True
ORD451640,ID0634780047,2019-07-28,Thompson,"[('Olivia x460', 2), ('Alcon 10', 2), ('iAssist Line', 1)]",22575,49.9,-37.8129499,144.93928789999995,0,22624.9,Winter,False,0.685,i returned the phone because it was described as new ... i returned the phone because it was described as new but something about the screen didn't seem new. it had a wave in it that was noticeable in reflections.,False
ORD074523,ID4234880967,2019-12-16,Nickolson,"[('Universe Note', 1), ('Thunder line', 1), ('iAssist Line', 2), ('Alcon 10', 2)]",27980,85.99,-37.804480100000006,144.9681961,0,28065.99,Summer,True,1.5757,limited service providers cant use the phone with any service provider,False
ORD432767,ID1449289339,2019-01-11,Bakers,"[('pearTV', 2), ('Universe Note', 1), ('Toshika 750', 2), ('Thunder line', 2)]",29070,73.9,-37.815304499999996,144.98582199999996,15,24783.4,Summer,False,1.0169,llego en perfecto estado a mi hijo le encanta,True
ORD180947,ID0571731483,2019-09-03,Thompson,"[('iStream', 2), ('Candle Inferno', 1)]",730,82.67,-37.82440620000001,144.9447001,0,812.67,Spring,False,1.3226,amazing condition phone in amazing condition and a screen protector attached 👍🏼👍🏼,True
ORD346840,ID0031477170,2019-11-16,Bakers,"[('Olivia x460', 2), ('iStream', 2), ('Thunder line', 2), ('Lucent 330S', 2)]",9570,107.64,-37.7992696,144.9873399,0,9677.64,Spring,True,1.3811,three stars it's ok but need a good battery and not enough memorize enough space by speed,True
ORD407678,ID2481930668,2019-09-15,Bakers,"[('Universe Note', 1), ('iAssist Line', 1), ('Candle Inferno', 1)]",6105,98.91,-37.8098465,145.00289619999995,15,5288.16,Spring,True,0.6742,five stars great company. good phone. i will buy another one for my family.,True
ORD283627,ID0298046181,2019-04-30,Nickolson,"[('Universe Note', 2), ('pearTV', 2), ('Thunder line', 2), ('Toshika 750', 2)]",32520,78.61,-37.821742900000004,144.96578359999995,15,27720.61,Autumn,True,0.4822,perfect good value for those looking for a cheap mobile phone that meets their needs,True
ORD345820,ID0312718321,2019-01-01,Thompson,"[('Olivia x460', 1), ('iAssist Line', 1), ('Universe Note', 1), ('iStream', 1)]",7050,100.64,-37.8033086,144.9615678,5,6798.14,Summer,True,1.647,five stars good phone granddaughter really likes it,True
ORD035929,ID0844496219,2019-04-22,Thompson,"[('iStream', 2), ('Alcon 10', 2), ('Toshika 750', 1)]",22520,78.52,-37.8199985,144.9505275,0,22598.52,Autumn,True,0.8703,"good phone, easy set up the battery charges quick and stays charged. i don't have to charge it often. everything works. i just put my sim card in from my old phone, turned it on, connected it to my wifi and within 5 minutes it was working perfectly fine.",True
ORD159300,ID2190560994,2019-07-20,Nickolson,"[('iAssist Line', 1), ('Olivia x460', 2), ('Lucent 330S', 2), ('pearTV', 1)]",13445,50.14,-37.8142364,144.963148,25,10133.89,Winter,False,0.7433,"not unlocked - only works with at&t network this is nor an unlocked cellphone. if you are not in us, dont buy this cellphone. only works with at&t network.",False
ORD051795,ID5446793543,2019-08-08,Nickolson,"[('Olivia x460', 2), ('iStream', 1), ('Alcon 10', 1)]",11550,88.28,-37.832819,144.9905243,10,10483.28,Winter,True,2.4306,three stars its nice but i was wondering if this phone takes a sim card,True
ORD247406,ID0702372647,2019-06-09,Thompson,"[('Alcon 10', 1), ('pearTV', 2)]",21570,62.99,-37.806192100000004,144.9417903,25,16240.49,Winter,True,0.8579,disappointed when i received the phone it wasn't in a sleeve. it was just the box which was not tapped to prevent the box from opening. it was missing the owners manual and the small key to remove the back of the phone. the phone looked like a return. it didn't look new.,False
ORD437256,ID4716795352,2019-04-13,Thompson,"[('Lucent 330S', 2), ('Universe Note', 1), ('Candle Inferno', 1), ('Toshika 750', 2)]",14980,67.23,-37.8192381,144.95279299999999,0,15047.23,Autumn,False,0.8874,this was a great purchase! love the fact i can download tv or movies and watch off-line. easy set up.,True
ORD234759,ID0592818918,2019-07-05,Nickolson,"[('Toshika 750', 1), ('Candle Inferno', 1), ('Universe Note', 1), ('pearTV', 1)]",14510,56.99,-37.8162374,144.9677926,10,13115.99,Winter,False,0.3046,we returned this item after 2 weeks. it took a lot of repeated request to get it to listen to us and it just wasn't as easy to use as i thought it would be.,False
ORD431549,ID3366919124,2019-05-29,Bakers,"[('iAssist Line', 2), ('Toshika 750', 1)]",8770,68.64,-37.8099705,145.0131639,5,8400.14,Autumn,False,1.577,love it phone works well and i love everything about it! at first i thought the phone had an issue but it was t-mobile sim card. i called them and the activated it!,True
ORD255699,ID6167236639,2019-02-28,Thompson,"[('iStream', 2), ('Candle Inferno', 1), ('Olivia x460', 2)]",3180,91.32,-37.8143014,144.9548242,15,2794.32,Summer,True,0.7057,tough phone bought it for my father. it's bright and seems indestructible even without a case. to date he's happy.,True
ORD352087,ID4234925754,2019-12-28,Nickolson,"[('Thunder line', 2), ('Candle Inferno', 2), ('pearTV', 1), ('Alcon 10', 2)]",29430,80.67,-37.804585100000004,144.96755259999995,25,22153.17,Summer,False,1.5694,thank you! great phone and quality with a low price!,True
ORD466931,ID1463620587,2019-02-21,Bakers,"[('Thunder line', 2), ('Alcon 10', 2)]",22260,77.58,-37.8172423,145.00721380000005,5,21224.58,Summer,False,1.327,fantastic phone all around great android phone and still hold up now after 2 years now. feels quick and snappy and the charging is fast. google assistant integration is an amazing thing and just makes everyday life easier.,True
ORD000350,ID2383215085,2019-12-11,Thompson,"[('Lucent 330S', 2), ('Alcon 10', 2)]",20360,98.73,-37.8040396,144.9587842,25,15368.73,Summer,True,1.409,bought as a christmas present. son uses it to watch youtube and netflick. works great.,True
ORD222185,ID0778812520,2019-05-15,Thompson,"[('Lucent 330S', 1), ('Alcon 10', 2), ('Toshika 750', 1), ('pearTV', 1)]",29760,83.32,-37.7998114,144.95834240000005,0,29843.32,Autumn,True,1.7415,best deal ever great value superb specs second to none,True
ORD301389,ID6167441046,2019-05-15,Nickolson,"[('Olivia x460', 1), ('iStream', 2), ('iAssist Line', 1), ('Thunder line', 1)]",5930,65.02,-37.81125220000001,144.96177360000001,0,5995.02,Autumn,True,1.0658,"bad battery life and has some scratch the battery life is 77% !! its bad . also , the cover of it is not clear 100% it has some scratch",False
ORD003982,ID0582798760,2019-10-27,Nickolson,"[('iStream', 1), ('Alcon 10', 2), ('Lucent 330S', 2)]",20510,88.28,-37.8234385,144.9792752,25,15470.78,Spring,True,1.0109,"one star you lied, it wasn't unlocked it was a prepaid phone. thanks for stealing my money.",False
ORD244721,ID0836066530,2019-11-22,Thompson,"[('iAssist Line', 2), ('pearTV', 1), ('Universe Note', 2), ('Toshika 750', 1)]",21980,86.14,-37.820783,144.94864730000003,25,16571.14,Spring,True,0.9134,the particular phone that i received had copious problems that ... the particular phone that i received had copious problems that made it extremely irritating to operate. it was quite faulty and i had to deal with many incidents where i almost threw the phone.,False
ORD352992,ID0632033055,2019-11-18,Thompson,"[('Lucent 330S', 1), ('Alcon 10', 2)]",19130,98.99,-37.813614,144.9537664,0,19228.99,Spring,True,0.5982,five stars good phone. love it,True
ORD115219,ID5982185646,2019-11-17,Nickolson,"[('Alcon 10', 1), ('Toshika 750', 2)]",17590,81.64,-37.8075748,144.9629982,0,17671.64,Spring,False,1.3553,love this phone love this phone!!!! after 7years with alcon there's nothing i miss. this phone is secretly water proof as well. toshika is the best. get it👊👊,True
ORD098740,ID3067843937,2019-01-25,Bakers,"[('iStream', 2), ('Universe Note', 2)]",7200,97.2,-37.8006565,145.00315930000005,25,5497.2,Summer,True,1.2518,got this thing around black friday and only paid about 50 something bucks. awesome equipment you can actually stream the web very glad i bought it can't believe it so inexpensive!,True
ORD444150,ID1466671807,2019-07-20,Thompson,"[('Thunder line', 1), ('Universe Note', 2), ('Candle Inferno', 2), ('iAssist Line', 2)]",14390,83.87,-37.8239154,144.9299158,25,10876.37,Winter,True,1.9599,five stars got my phone fast and works and looks great,True
ORD117088,ID0443302588,2019-06-11,Bakers,"[('pearTV', 1), ('Candle Inferno', 1), ('iAssist Line', 1), ('Universe Note', 2)]",15865,66.36,-37.81252960000001,145.0049281,0,15931.36,Winter,False,0.8981,"great phone this works great, like my previous note 5",True
ORD444565,ID1668523489,2019-04-28,Thompson,"[('Alcon 10', 2), ('Thunder line', 2)]",22260,66.15,-37.8239328,144.9494145,0,22326.15,Autumn,True,1.2702,not compatible with sprint!! purchased phone and tried to get it setup at a sprint store and was informed that the phone was tampered with and is not compatible with the sprint network.,False
ORD339592,ID0038779052,2019-05-14,Bakers,"[('Universe Note', 2), ('iAssist Line', 1)]",9125,82.42,-37.7998315,144.9929005,0,9207.42,Autumn,True,1.1499,good value at a very affordable price. can't beat it.,True
ORD395052,ID4234880956,2019-03-11,Nickolson,"[('Universe Note', 2), ('Olivia x460', 2), ('Thunder line', 2)]",13710,53.6,-37.804274,144.9689013,5,13078.1,Autumn,False,1.5952,"does not work on verizon services anymore purchased cell phone and attempted to activate it by dialing *228, it kept telling me that it was unable to activate. i called verizon customer service and they told me that verizon no longer offers 3g services and that the phone will not be able to receive cellular signal.",False
ORD354235,ID4633770157,2019-09-11,Thompson,"[('Thunder line', 2), ('pearTV', 1), ('Toshika 750', 2)]",19310,87.83,-37.80652070000001,144.944874,10,17466.83,Spring,True,0.7116,one star phone was not unlocked i sent it back,False
ORD133027,ID4735688182,2019-12-20,Thompson,"[('Thunder line', 1), ('Alcon 10', 1), ('iStream', 1)]",11280,96.61,-37.8032727,144.94942,15,9684.61,Summer,True,1.0667,excellent conditions it is working very well.,True
ORD359261,ID4936948367,2019-01-08,Bakers,"[('Thunder line', 1), ('Candle Inferno', 2), ('iStream', 1)]",3190,76.11,-37.808845899999994,144.9838325,25,2468.61,Summer,False,1.0107,five stars works great,True
ORD082249,ID4794459318,2019-06-01,Thompson,"[('Universe Note', 2), ('Thunder line', 2), ('Olivia x460', 1)]",12485,54.53,-37.8040696,144.9335986,25,9418.28,Winter,False,1.5234,"worst phone i ever had dont waste your money freezes, dies, beeps when no message, doesnt beep when there is a message, terrible reception, bad camera, boost says just take battery out and put back in",False
ORD131064,ID6167489387,2019-10-22,Thompson,"[('iStream', 1), ('Thunder line', 1), ('Candle Inferno', 2), ('Universe Note', 2)]",10090,77.76,-37.8095602,144.95748759999995,0,10167.76,Spring,False,0.9796,amazing! worth every penny! just hope i don't drop it!,True
ORD317463,ID0202690479,2019-09-29,Thompson,"[('Olivia x460', 1), ('Universe Note', 1), ('iAssist Line', 1), ('pearTV', 2)]",19520,92.54,-37.804446899999995,144.91663180000003,5,18636.54,Spring,True,2.8292,i love my note 8 i love my note 8! it takes awesome pictures and it's very fast. i love the live messaging feature and the screen is so big!,True
ORD271421,ID0035354783,2019-12-29,Thompson,"[('Alcon 10', 2), ('Lucent 330S', 2)]",20360,74.26,-37.8079709,144.9518889,10,18398.26,Summer,False,0.6736,very convenient excelent display everything was great! only problem was battery at 91percent but was expected as it is refurbish,True
ORD205132,ID3146808114,2019-02-08,Bakers,"[('Thunder line', 2), ('Candle Inferno', 1)]",4790,78.48,-37.80956629999999,144.9836123,5,4628.98,Summer,True,1.023,×××××××××× phone just worked 9 months i still have it as on my tv entreteimen center as a reminder to never buy used things from digicoe again,False
ORD499675,ID0664380198,2019-04-05,Nickolson,"[('Lucent 330S', 1), ('pearTV', 2), ('Candle Inferno', 1)]",14280,48.76,-37.819579600000004,144.9688826,10,12900.76,Autumn,False,0.1244,received a used phone when i ordered a new one. very unhappy. will change review if/when fixed.,False
ORD054237,ID3360746852,2019-05-05,Bakers,"[('Alcon 10', 2), ('Thunder line', 1), ('Olivia x460', 2)]",22530,80.68,-37.804702899999995,144.9932568,0,22610.68,Autumn,True,0.6143,works really good great,True
ORD057070,ID0277363204,2019-06-01,Bakers,"[('Universe Note', 1), ('Candle Inferno', 2), ('pearTV', 2)]",16930,68.77,-37.8107321,145.0100246,0,16998.77,Winter,False,1.3035,five stars great phone. and in great condition.,True
ORD218182,ID2293523305,2019-12-20,Bakers,"[('Alcon 10', 2), ('iAssist Line', 1)]",20125,98.06,-37.7991659,144.99446880000005,10,18210.56,Summer,True,1.2075,five stars luv best thing ever must buy,True
ORD069676,ID4234880940,2019-08-19,Nickolson,"[('Thunder line', 1), ('Universe Note', 2), ('Alcon 10', 1), ('Toshika 750', 1)]",22350,52.41,-37.8042909,144.96907230000005,0,22402.41,Winter,False,1.5928,"signal problem, os problem, internet problem there many things are going wrong! phone shows full service but when i am called from other phones, it is not reachable. android runs wieerdly etc...",False
ORD317811,ID0594801681,2019-08-06,Nickolson,"[('Alcon 10', 2), ('iAssist Line', 1)]",20125,76.57,-37.8119336,144.9672113,15,17182.82,Winter,True,0.7695,100 % worth the money. 100 % worth the money.,True
ORD303862,ID1449355155,2019-09-30,Nickolson,"[('Thunder line', 2), ('pearTV', 1)]",10670,99.46,-37.8155397,144.973457,5,10235.96,Spring,True,0.4834,five stars my s3 died and this was a good value replacement,True
ORD119321,ID0245531251,2019-01-19,Nickolson,"[('Toshika 750', 2), ('pearTV', 2), ('Candle Inferno', 1)]",21690,91.86,-37.81238610000001,144.96564840000005,15,18528.36,Summer,True,0.7717,great quality works great! my mom loves it,True
ORD087271,ID0306905333,2019-04-26,Thompson,"[('Universe Note', 2), ('pearTV', 2), ('iAssist Line', 1), ('Alcon 10', 1)]",30695,64.08,-37.8109485,144.9389868,5,29224.33,Autumn,True,0.7362,one star too sma too much crap with verizon,False
ORD042531,ID0161467106,2019-11-04,Thompson,"[('Thunder line', 1), ('Candle Inferno', 2), ('Olivia x460', 2), ('iStream', 1)]",5640,78.4,-37.8124016,144.9579478,0,5718.4,Spring,False,0.9572,too much specificacions and functionalities! great phone,True
ORD463977,ID4299936439,2019-02-10,Bakers,"[('Universe Note', 1), ('Alcon 10', 1), ('Candle Inferno', 1)]",12830,63.97,-37.8165505,145.00934230000001,0,12893.97,Summer,False,1.4395,"good before android pie this was a good phone up until android pie update rolled through this summer. now phone is sluggish and constantly crashing. do a search on g6, android pie before buying this phone and you'll see how frustrated users are. sad be it was a good phone.",False
ORD417124,ID3213448187,2019-01-15,Thompson,"[('Alcon 10', 1), ('Lucent 330S', 2), ('Candle Inferno', 2), ('iAssist Line', 2)]",16720,97.13,-37.80475,144.9581608,0,16817.13,Summer,True,1.3151,great seller works really just like new,True
ORD402229,ID0233314970,2019-03-19,Bakers,"[('Candle Inferno', 1), ('Alcon 10', 1), ('Toshika 750', 2), ('pearTV', 1)]",24330,84.6,-37.80295200000001,144.9765919,0,24414.6,Autumn,True,1.8173,five stars great phone!!!!,True
ORD268695,ID0298046578,2019-08-02,Nickolson,"[('iAssist Line', 1), ('Toshika 750', 2), ('Thunder line', 1), ('iStream', 2)]",13345,73.92,-37.82083770000001,144.9666228,5,12751.67,Winter,True,0.3586,exactly like send for somebody else,True
ORD333256,ID0060096109,2019-07-05,Nickolson,"[('pearTV', 1), ('Lucent 330S', 1)]",7540,67.64,-37.816933,144.9833196,10,6853.64,Winter,False,1.2248,is a nice phone i love this phone the cameras are amazing,True
ORD499314,ID0746912628,2019-07-16,Nickolson,"[('iStream', 1), ('Thunder line', 1), ('Candle Inferno', 1), ('pearTV', 2)]",15380,53.02,-37.82551779999999,144.9846044,5,14664.02,Winter,False,1.5317,don't buy phone is 2g not 4g lte sellers says 4g lte but phone is 2g per at&t,False
ORD295221,ID0844418490,2019-09-24,Thompson,"[('pearTV', 2), ('Olivia x460', 1), ('Alcon 10', 2)]",31745,100.99,-37.8199083,144.94689340000005,0,31845.99,Spring,True,0.8055,"five stars very good, excelente",True
ORD392419,ID0163364760,2019-11-29,Thompson,"[('Lucent 330S', 1), ('Thunder line', 2)]",5590,74.03,-37.8140035,144.9524232,10,5105.03,Spring,False,0.4936,three stars cool,True
ORD111376,ID0576868170,2019-03-29,Nickolson,"[('Olivia x460', 1), ('Candle Inferno', 1), ('Toshika 750', 2), ('iStream', 2)]",10595,52.65,-37.8237007,144.9868771,25,7998.9,Autumn,False,1.6261,"if you use metro or tmobile in usa, you can't get 4glte i ignored the reviews to use caution with us sales and regret it now. the seller is misleading, while the phone does work with metro, it can't get 4g lte, leaving you with bad service most of the time. also, the sim card try on mines was stuck.",False
